{"request_id":"RC:REQUEST:S002","actor_id":"RC:ACTOR:001","operation":"OPEN_AMENDMENT","target_id":"RC:PLAN:0001","expected_version":1,"occurred_at":"2030-03-02T09:00:00+08:00","related_document_ids":[],"payload":{"new_version":2},"payload_hash":"sha256:7b6798f63b63e18d7f5014018941bc9b4ed8ee1495c58c5d55507c91f340036c"}