{"request_id":"RC:REQUEST:S005","actor_id":"RC:ACTOR:006","operation":"VERIFY","target_id":"RC:DOC:000001","expected_version":1,"occurred_at":"2030-03-05T09:00:00+08:00","related_document_ids":["RC:DOC:000001"],"payload":{"tampered":true},"payload_hash":"sha256:94c09080b629d72e04a6ae19317d3b38934fbb9c52bafe76e9986a26f4c544b5"}