{"request_id":"RC:REQUEST:S007","actor_id":"RC:ACTOR:005","operation":"SUBMIT_PROJECT_APPLICATION","target_id":"RC:PARCEL:000001","expected_version":1,"occurred_at":"2030-03-07T09:00:00+08:00","related_document_ids":[],"payload":{"project_geometry":"crosses_ecological_constraint"},"payload_hash":"sha256:2cfd6c6913d699be6b04890d83a06b5c1ae6c24f6a094d8f0267dd9cae63b07a"}